Sort,Image,Title,Link,Dataset Id
1,https://controllerdata.lacity.org/views/hmvt-bjfk/files/70cVAjGvVyt5JG9Bd0TYfczVjcOxvVm9NFmJeGbLaTc, Where exactly does the City get its money?  Check out City revenues here.,https://controllerdata.lacity.org/Finance/FY2013-General-Fund-Revenues-by-Revenue-Class/fbs3-k6nk,fbs3-k6nk
2,https://controllerdata.lacity.org/views/hmvt-bjfk/files/FhdNRU0uIZaXewa9_ZPraH4zXRUUsmk-KoIytuyiZZM,Open data: Holding up the mirror to the City. Click here to explore the City's expenditures. ,https://controllerdata.lacity.org/Finance/FY2013-General-Fund-Expenditures-by-Account-Name/x23h-7hzr,x23h-7hzr
3,https://controllerdata.lacity.org/views/hmvt-bjfk/files/GFKAwIRqWQkHY8KnthbVq7JPamEJBciknb66VnA-e0Y," In the dark on the City's finances? 
 We're turning on the lights: CheckbookLA is here.",https://controllerdata.lacity.org/checkbook/2013,pggv-e4fn
4,https://controllerdata.lacity.org/views/hmvt-bjfk/files/E6XAWSvzJ-9JvZnXXYB-mPe74uJjn4WD67ZnPdOxINE,Open data: The road to open government.  Click here to explore the City’s data catalog.,https://controllerdata.lacity.org/browse,
